{
  "$schema": "https://json-schema.org/draft/2020-12/schema",
  "$id": "https://thingstudio.net/schemas/custom-node.schema.json",
  "title": "Thingstudio custom node descriptor (.node.json)",
  "description": "The descriptor half of a custom node package. Authoritative prose and the cross-field rules the schema can't express: interfaces/node-descriptor/SPEC.md. User walkthrough: docs/user-guide/custom-nodes.md. The editor currently ignores unknown top-level keys for forward compatibility; this schema flags them.",
  "type": "object",
  "additionalProperties": false,
  "required": ["type", "kind", "label"],
  "properties": {
    "type": {
      "type": "string",
      "pattern": "^[a-z][a-z0-9_]*/[a-z][a-z0-9_]*$",
      "not": { "pattern": "^thingstudio/" },
      "description": "Namespace/name id, e.g. custom/dht22. The thingstudio/ namespace is reserved for built-ins."
    },
    "kind": { "enum": ["source", "transform", "sink"], "description": "Decides where the node sits in a flow and which entry function .node.py must define." },
    "label": { "type": "string", "minLength": 1, "description": "Name shown on the canvas and in the palette." },
    "description": { "type": "string", "minLength": 1, "description": "Short self-documenting blurb shown in the property panel." },
    "color": { "type": "string", "description": "CSS color for the node outline. Default grey." },
    "bgcolor": { "type": "string", "description": "CSS color for the node fill. Default grey." },
    "icon": { "type": "string", "description": "One or two characters shown in the icon chip." },
    "group": { "type": "string", "minLength": 1, "description": "Palette section. Default 'general'; a new name gets its own section after the built-in ones." },
    "priority": { "type": "number", "description": "Order within group, lower first. Omit to sort after every built-in in that group." },
    "ports": {
      "type": "object",
      "additionalProperties": false,
      "properties": {
        "inputs": { "type": "array", "items": { "$ref": "#/$defs/port" } },
        "outputs": { "type": "array", "items": { "$ref": "#/$defs/port" } }
      }
    },
    "properties": { "type": "array", "items": { "$ref": "#/$defs/propertyField" } },
    "requires": { "$ref": "#/$defs/requires" }
  },
  "$defs": {
    "requires": {
      "type": "object",
      "additionalProperties": false,
      "description": "Hardware the node needs; checked centrally against the target at compile time.",
      "properties": {
        "capabilities": {
          "type": "array",
          "items": { "type": "string", "minLength": 1 },
          "description": "Capability names the node needs, e.g. [\"pio\"] or [\"espnow\"]."
        }
      }
    },
    "port": {
      "type": "object",
      "additionalProperties": false,
      "required": ["name", "type"],
      "properties": {
        "name": { "type": "string", "pattern": "^[a-zA-Z_][a-zA-Z0-9_]*$", "description": "Port key, a Python identifier." },
        "type": { "enum": ["int", "number", "bool", "string", "bytes", "any"], "description": "Wire type, checked when wires are drawn." }
      }
    },
    "propertyField": {
      "type": "object",
      "additionalProperties": false,
      "required": ["name", "label", "kind", "default"],
      "properties": {
        "name": { "type": "string", "pattern": "^[a-zA-Z_][a-zA-Z0-9_]*$", "description": "Dict key your Python reads the value by." },
        "label": { "type": "string", "minLength": 1, "description": "Shown in the property panel." },
        "kind": { "enum": ["text", "number", "boolean", "select"], "description": "Field type. 'default' must match it." },
        "default": { "description": "Used when a node instance doesn't set the property. Type must match kind." },
        "options": {
          "type": "array",
          "minItems": 1,
          "items": {
            "type": "object",
            "additionalProperties": false,
            "required": ["value", "label"],
            "properties": { "value": { "type": "string" }, "label": { "type": "string", "minLength": 1 } }
          },
          "description": "Required for kind 'select'; 'default' must be one of the values."
        }
      },
      "allOf": [
        { "if": { "properties": { "kind": { "const": "select" } }, "required": ["kind"] }, "then": { "required": ["options"] } }
      ]
    }
  }
}
